PMID	PMCID	Sentences
28183012	PMC5425289	Therefore, more studies are needed to gather evidence for development of effective intervention strategies that aim at reducing health disparities across socioeconomic strata.
37934719	PMC10629619	A concurrent increase in local officials' accountability presumably compelled by public scrutiny and the urgency of case-finding to curb viral spread may have likewise facilitated timely distribution of RT-PCR tests and other health services to subnational units in more decentralized governments, though this may be complicated by the undesired tendency of services being overprovided to socioeconomic strata that can afford them.
20810807	PMC2929038	After the standard monitoring and evaluation framework for RBM, authors examined policy and strategy decision making, the use of financial resources (inputs), service delivery (process and outputs), intervention coverage (outcomes), and health and economic improvements (impact) across urban and rural settings and across socioeconomic strata.
39544584	PMC11563449	In conclusion, the obesity epidemic's expansion concerning affecting different age groups, ethnic/racial groups, and socioeconomic strata, as well as communities in the United States, Canada, and other nations, has resulted in the paradigm shift toward the adoption of public health interventions and policies capable of reaching different populations and communities.
41057554	PMC12504151	Intimate partner violence (IPV) is a subject of global public health significance, with adverse effects that occur across all races, societies, and socioeconomic strata.
37899791	PMC10603236	Additionally, because the population was only Peruvian men, we cannot speak for all Latin-American men and their experiences, or of all Peruvian men such as those who live in rural areas or who belong to other socioeconomic strata who do not use public health services.
40474941	PMC12140057	These findings indicate a need for enhanced public health preventive interventions, particularly for younger women in lower socioeconomic strata and those with a history of addictive substance use.
37575853	PMC10422057	Congenital malformations in the low socioeconomic strata of developing countries represent a significant public health concern with far-reaching implications.
34214137	PMC8253448	Both municipality effects and family affluence account for a relatively small proportion of the total variance in the students' psychological symptoms loads; however, the mental health inequalities we explored between socioeconomic strata on both the individual and municipal levels are not insignificant in a public health perspective.
39569227	PMC11578681	In Brazil, sealants are primarily used in public health interventions for children in lower socioeconomic strata or rural areas, often as part of community-based initiatives.